{
  "stampVersion": "1.0",
  "artifactId": "capsule://eco/auth-helper@1.2.0",
  "tier": "gold",
  "signedBy": {
    "agent": "capsule-creator",
    "conductor": "oursynth-conductor"
  },
  "signatures": {
    "agent": "ed25519:...agent",
    "conductor": "ed25519:...conductor"
  },
  "sbom": "sha256:...sbom",
  "chaos": {
    "smoke": "green",
    "rollbackScript": "ok",
    "rehearsalAt": "2025-10-03T23:59:59Z"
  },
  "observability": {
    "dashboardsPatched": true,
    "sloImpact": "none",
    "alertsUpdated": ["capsule_publish", "latency_spike"]
  }
}